{
  "schema_version": "1.0",
  "commentary_id": "COMMENTARY-THERMAL-000001",
  "scope": "infographic",
  "result_ids": ["RESULT-THERMAL-000001"],
  "method_refs": [
    {"id": "thermal-seasons", "version": "1.0.0"}
  ],
  "summary": "La période récente présente un été thermique plus précoce et plus long dans cette réanalyse.",
  "findings": [
    {
      "id": "finding-1",
      "text": "L'été thermique médian commence 11 jours plus tôt entre 1996–2005 et 2016–2025.",
      "signal_ids": [
        "thermal-summer-start-shift:POINT-44.0646-3.6830:1996-2005_vs_2016-2025"
      ],
      "claim_level": "descriptive"
    }
  ],
  "caveats": [
    {
      "id": "thermal-not-meteorological-season",
      "text": "Il s'agit d'une saison thermique locale, pas de la saison météorologique.",
      "signal_ids": [
        "thermal-summer-start-shift:POINT-44.0646-3.6830:1996-2005_vs_2016-2025"
      ]
    }
  ],
  "abstentions": [],
  "generation": {
    "generated_at": "2026-08-09T20:46:00Z",
    "service": "climate-commentary-service",
    "model": "example-model",
    "prompt_version": "1.0.0"
  },
  "validation": {
    "status": "valid",
    "all_findings_have_signal_evidence": true,
    "unsupported_claims": []
  }
}
