{
  "schema_version": "1.0",
  "commentary_id": "COMMENTARY-VALIDATION",
  "scope": "sheet",
  "result_ids": [
    "RESULT-OVERVIEW-VALIDATION",
    "RESULT-FINGERPRINT-VALIDATION",
    "RESULT-SEASONS-VALIDATION",
    "RESULT-WATER-VALIDATION"
  ],
  "method_refs": [
    {"id": "climate-overview", "version": "1.0.0"},
    {"id": "climate-fingerprint", "version": "4.0.0"},
    {"id": "thermal-seasons", "version": "1.0.0"},
    {"id": "water-through-year", "version": "1.0.0"}
  ],
  "summary": "Le climat du lieu présente un réchauffement récent, un calendrier thermique décalé et des évolutions du cycle de l’eau qui ne vont pas toutes dans le même sens.",
  "findings": [
    {
      "id": "finding-climat-habituel",
      "text": "La climatologie de référence associe une température moyenne annuelle de 11,1 °C à environ 1327,3 mm de précipitations par an.",
      "signal_ids": ["overview-temp:validation", "overview-precip:validation"],
      "claim_level": "descriptive"
    },
    {
      "id": "finding-rechauffement",
      "text": "Entre les deux décennies comparées, la température est plus élevée de 1,12 °C et l’UTCI de 1,62 °C.",
      "signal_ids": ["fingerprint-temp:validation", "fingerprint-utci:validation"],
      "claim_level": "descriptive"
    },
    {
      "id": "finding-saisons",
      "text": "L’été thermique commence 17,69 jours plus tôt, l’automne 15,27 jours plus tard et l’été thermique dure 28,66 jours de plus.",
      "signal_ids": ["summer-start:validation", "autumn-start:validation", "summer-length:validation"],
      "claim_level": "descriptive"
    },
    {
      "id": "finding-eau",
      "text": "La période récente présente 9,19 % de précipitations annuelles en moins et 11,78 mm de stock d’eau estival modélisé en moins, tandis que le nombre de mois secs SPEI-3 est inférieur de 1,0 mois par an.",
      "signal_ids": ["water-precip:validation", "water-soil:validation", "water-dry-months:validation"],
      "claim_level": "descriptive"
    }
  ],
  "caveats": [
    {
      "id": "gridded-reanalysis",
      "text": "Ces résultats décrivent le contexte de la maille de réanalyse associée au lieu, pas une mesure réalisée exactement sur la parcelle.",
      "signal_ids": ["overview-temp:validation", "fingerprint-temp:validation", "summer-start:validation", "water-precip:validation"]
    },
    {
      "id": "descriptive-not-trend",
      "text": "Les écarts entre périodes sont descriptifs et ne constituent pas un test de tendance statistique.",
      "signal_ids": ["fingerprint-temp:validation", "summer-start:validation", "water-precip:validation"]
    }
  ],
  "abstentions": [],
  "generation": {
    "generated_at": "2026-08-10T08:00:00Z",
    "service": "climate-commentary-service",
    "model": "test-model",
    "prompt_version": "climate-commentary-p1@1.0.0"
  },
  "validation": {
    "status": "valid",
    "all_findings_have_signal_evidence": true,
    "unsupported_claims": []
  }
}
